{
  "encounterId": "c81f6d20-5a47-4e93-b2d8-1f70e4a95c33",
  "mediaId": "3d0a2c5e-8f14-4b6a-9c27-5e81d4f0a912",
  "kind": "EVENT_VIDEO",
  "fileName": "event.mp4",
  "sizeBytes": 2775794,
  "sha256": "3f2a9b4e8c1d5a7f2e6b0c9d8a3f4e5b6c7d8e9f0a1b2c3d4e5f6a7b8c9d0e1f",
  "contentType": "video/mp4",
  "suggestedKey": "SENTINEL-01/c81f6d20-5a47-4e93-b2d8-1f70e4a95c33/event.mp4"
}
